{"UserId":"e0431a92-9d0f-4b4a-b8f0-58e0b0f2e6a5","UserName":"alice@eshop","OrderNumber":0,"City":"Seattle","Street":"123 Main St","State":"WA","Country":"U.S.","ZipCode":"98101","CardNumber":"4012888888881881","CardHolderName":"Alice Smith","CardExpiration":"2025-12-31T00:00:00Z","CardSecurityNumber":"535","CardTypeId":1,"Buyer":"alice@eshop","RequestId":"aaaaaaaa-bbbb-cccc-dddd-eeeeeeeeeeee","Basket":{"BuyerId":"alice@eshop","Items":[{"Id":"basket-item-1","ProductId":1,"ProductName":".NET Bot Black Hoodie","UnitPrice":19.50,"OldUnitPrice":18.00,"Quantity":2,"PictureUrl":"http://externalcatalogbaseurltobereplaced/c/api/v1/catalog/items/1/pic/"}]},"Id":"11111111-2222-3333-4444-555555555555","CreationDate":"2020-01-02T03:04:05.678Z"}